{
  "access": {
    "kubernetes": {
      "context": "context:611e49b22818",
      "identity": "identity:547a4b6a7894",
      "server": "server:6076e1dcf760"
    }
  },
  "captured_at": "2026-10-18T02:45:53.046765+00:00",
  "cleanup": {
    "failures": [],
    "resources": [
      {
        "absent": true,
        "kind": "Pod",
        "name": "ci-skills-run-tool-pod-f669cea49ae538d1",
        "namespace": "ci-skills-run-f22af9d644d64fb289dc",
        "status": "PASS"
      },
      {
        "absent": true,
        "kind": "ConfigMap",
        "name": "ci-skills-run-tool-pod-scripts-f669cea49ae538d1",
        "namespace": "ci-skills-run-f22af9d644d64fb289dc",
        "status": "PASS"
      },
      {
        "absent": true,
        "kind": "Namespace",
        "name": "ci-skills-run-f22af9d644d64fb289dc",
        "namespace": "",
        "status": "PASS"
      }
    ],
    "retained": [],
    "status": "PASS"
  },
  "errors": [],
  "filters": {},
  "kind": "tool_pod",
  "operation": "remove",
  "plan": {
    "functional_digest": "856dadd68651a9c393636c97bc9fe9aa51c44470f105148347c774f8fa69fc30",
    "kind": "tool_pod",
    "operation": "remove",
    "run_id": "c5639c8c32af4cfab8ca8a3dff4abdc5",
    "spec": {},
    "target": {
      "context": "context:611e49b22818",
      "server": "server:6076e1dcf760"
    },
    "timeout_seconds": 600
  },
  "plan_digest": "cefc8c3937f141590cae7fc3c7cfbac75bf40837123d65cf6c6c3191a5331876",
  "readback": {
    "action": "APPLIED",
    "resources": [
      {
        "absent": true,
        "kind": "Pod",
        "name": "ci-skills-run-tool-pod-f669cea49ae538d1",
        "namespace": "ci-skills-run-f22af9d644d64fb289dc",
        "status": "PASS"
      },
      {
        "absent": true,
        "kind": "ConfigMap",
        "name": "ci-skills-run-tool-pod-scripts-f669cea49ae538d1",
        "namespace": "ci-skills-run-f22af9d644d64fb289dc",
        "status": "PASS"
      }
    ],
    "run_id": "c5639c8c32af4cfab8ca8a3dff4abdc5",
    "scopes": [
      {
        "namespace": "ci-skills-run-f22af9d644d64fb289dc",
        "owns_namespace": true,
        "run_id": "c5639c8c32af4cfab8ca8a3dff4abdc5"
      }
    ],
    "verified": true
  },
  "records": [
    {
      "callback": "K8SAuth",
      "context": "context:611e49b22818",
      "identity": "identity:547a4b6a7894",
      "server": "server:6076e1dcf760"
    },
    {
      "action": "VERIFIED",
      "callback": "ResolveRunScopes",
      "run_id": "c5639c8c32af4cfab8ca8a3dff4abdc5",
      "scopes": [
        {
          "namespace": "ci-skills-run-f22af9d644d64fb289dc",
          "owns_namespace": true,
          "run_id": "c5639c8c32af4cfab8ca8a3dff4abdc5"
        }
      ],
      "verified": true
    },
    {
      "action": "APPLIED",
      "callback": "RemoveToolPod",
      "resources": [
        {
          "absent": true,
          "kind": "Pod",
          "name": "ci-skills-run-tool-pod-f669cea49ae538d1",
          "namespace": "ci-skills-run-f22af9d644d64fb289dc",
          "status": "PASS"
        },
        {
          "absent": true,
          "kind": "ConfigMap",
          "name": "ci-skills-run-tool-pod-scripts-f669cea49ae538d1",
          "namespace": "ci-skills-run-f22af9d644d64fb289dc",
          "status": "PASS"
        }
      ],
      "run_id": "c5639c8c32af4cfab8ca8a3dff4abdc5",
      "scopes": [
        {
          "namespace": "ci-skills-run-f22af9d644d64fb289dc",
          "owns_namespace": true,
          "run_id": "c5639c8c32af4cfab8ca8a3dff4abdc5"
        }
      ],
      "verified": true
    },
    {
      "action": "APPLIED",
      "callback": "RemoveScope",
      "preserved_scopes": [],
      "resources": [
        {
          "absent": true,
          "kind": "Namespace",
          "name": "ci-skills-run-f22af9d644d64fb289dc",
          "namespace": "",
          "status": "PASS"
        }
      ],
      "run_id": "c5639c8c32af4cfab8ca8a3dff4abdc5",
      "verified": true
    }
  ],
  "run_id": "c5639c8c32af4cfab8ca8a3dff4abdc5",
  "schema_version": "1.0",
  "skill": {
    "algorithm": "sha256-tree-v1",
    "consuming_project": {
      "commit": null,
      "source": null
    },
    "digest": "e5aaa500d9b9aa69b61b95683595ce54442f9d28c8ad0f3ac25b499f3644de9f",
    "file_count": 159,
    "functional_digest": "856dadd68651a9c393636c97bc9fe9aa51c44470f105148347c774f8fa69fc30",
    "revision": {
      "source": "installer_record",
      "value": "2c615ffcc0c9ec16e323e8e72c7e6e0962897bca",
      "verified": true
    }
  },
  "status": "PASS",
  "summary": {
    "error_count": 0,
    "record_count": 4
  },
  "target": "target:7bd724cadedd",
  "target_file": "path:8617612df58d",
  "target_source": "project",
  "tested_revision": "2c615ffcc0c9ec16e323e8e72c7e6e0962897bca"
}
